,VideoID,Start,End,AnnotationTime,Description,true_id,Tenemos video
86518,fJr2evLANsE,0,10,31,A cat is playing and playing a turtle.,fJr2evLANsE_0_10,1
86581,unhiT2D6WvE,0,20,19,A cat playing in a box.,unhiT2D6WvE_0_20,1
86654,jDFn-1lXJ98,71,80,53,A dog runs and hides behind a tree.,jDFn-1lXJ98_71_80,1
86709,ogcqFaNbah4,475,487,19,Group of people are dancing.,ogcqFaNbah4_475_487,1
86814,fw8qvK67jYY,50,97,43,A man is juicing both halves of a lemon on a citrus juicer.,fw8qvK67jYY_50_97,1
86945,SaYwh6chmiw,15,40,85,A train slows down and stops.,SaYwh6chmiw_15_40,1
87016,BgoOihBb78w,38,40,57,"Two boys are singing and dancing, one behind the other.",BgoOihBb78w_38_40,1
87131,UoPU8F9mus8,258,262,24,A lady is exercising.,UoPU8F9mus8_258_262,1
87186,DGQL5lx-mwE,2,12,33,A woman makes a huge bubble.,DGQL5lx-mwE_2_12,1
87317,YersIyzsOpc,15,30,106,"A young man comes into a bedroom and throws a tantrum, slapping and hitting the bed covers.",YersIyzsOpc_15_30,1
87359,DhwrBs96Kgk,120,124,51,A monkey is walking on water.,DhwrBs96Kgk_120_124,1
87437,wX-Bl25Htag,104,115,53,A woman is talking while applying eyeshadow.,wX-Bl25Htag_104_115,1
87740,btuxO-C2IzE,64,72,85,A lion jumps up and is hugged and petted by two long-haired men.,btuxO-C2IzE_64_72,1
87891,cR2yi-JnGcQ,8,16,38,A woman is street walking her dog.,cR2yi-JnGcQ_8_16,1
87968,FeTaKOPVaJg,15,25,47,A group of young girls are dancing on stage.,FeTaKOPVaJg_15_25,1
88309,b4FM9OLBGyM,37,49,102,A young woman puts eyeliner on .,b4FM9OLBGyM_37_49,1
88386,02Z-kuB3IaM,2,13,60,A black boar is running in the woods.,02Z-kuB3IaM_2_13,1
88425,glrijRGnmc0,211,215,32,A man using a microwave,glrijRGnmc0_211_215,1
88570,kJY5BRCNAs4,3,6,46,a baby picks up a phone.,kJY5BRCNAs4_3_6,1
88637,UdcObAQ5OOM,15,30,72,A woman in a ski cap and sunglasses is riding in the back seat of a car talking on a cell phone.,UdcObAQ5OOM_15_30,1
88684,i2GgBwlwV0c,24,31,38,Milk is being poured into a mixer.,i2GgBwlwV0c_24_31,1
88741,lKpGc3SCSVw,12,20,42,Two roosters are fighting in a ring.,lKpGc3SCSVw_12_20,1
88808,2I20ZTFHheg,96,104,44,A person cuts a sock.,2I20ZTFHheg_96_104,1
88867,9zXqkHvs0po,59,65,19,An older woman is cracking eggs.,9zXqkHvs0po_59_65,1
88930,Pgm-mOQu2MM,48,62,16,A woman is dancing in rain.,Pgm-mOQu2MM_48_62,1
88992,sJSmRik2c-c,1,7,57,A yellow train is speeding down a track.,sJSmRik2c-c_1_7,1
89047,rV5VmhY3-Sw,65,76,36,A boy is singing in the street.,rV5VmhY3-Sw_65_76,1
89145,rXZy-PHtnxg,8,42,47,A man is window cleaning.,rXZy-PHtnxg_8_42,1
89216,GnwKcpfr_ng,10,20,67,A man and woman are sitting at a tv newsdesk talking.,GnwKcpfr_ng_10_20,1
89359,tJHUH9tpqPg,113,118,38,A woman is squeezing a lemon.,tJHUH9tpqPg_113_118,1
89414,PNMsPz1701c,3,20,105,"A boy picks up a large log with hand holds cut into it, and raises the log above his head.",PNMsPz1701c_3_20,1
89532,aGUx0QOKWXw,7,12,232,"An episode of ""I Love Lucy"" where Desi lights Lucy a cigarette.",aGUx0QOKWXw_7_12,1
89577,PugziVUikEg,117,140,63,A young woman does her eyebrow.,PugziVUikEg_117_140,1
89722,mOZkcBcWR8o,6,12,63,A young girl is pushing a toy stroller in a store.,mOZkcBcWR8o_6_12,1
89788,fcvW1vr8hAs,104,108,2409,A choir is singing.,fcvW1vr8hAs_104_108,1
89847,WTx-K045yQM,85,98,93,Someone is slicing a tomato with a serrated knife.,WTx-K045yQM_85_98,1
89903,WyIqGyj21Dk,0,10,91,Someone is drawing on George Washington's face on a one dollar bill.,WyIqGyj21Dk_0_10,1
89960,ymC2bNi6-Is,9,19,15,A guy is talking to another guy.,ymC2bNi6-Is_9_19,1
90210,lv8d_qLLqsk,1,20,30,A boy is playing a guitar.,lv8d_qLLqsk_1_20,1
90263,0GXq1An3yHI,22,35,50,A woman chops up curd.,0GXq1An3yHI_22_35,1
90451,AdcgmBtE99c,108,114,117,A woman sunbather takes sunglasses out of a dark bag and puts them on.,AdcgmBtE99c_108_114,1
90503,6njscWrdnM0,8,18,140,"Each time a man karate kicks a mannequin he falls down, so he finally starts punching the mannequin with his fists until it falls.",6njscWrdnM0_8_18,1
90554,0SMOK2ql7Pg,5,12,40,A cat scratches a board in the sink.,0SMOK2ql7Pg_5_12,1
90615,xb-Nacm-pKc,78,82,42,Pink Floyd performing onstage and video.,xb-Nacm-pKc_78_82,1
90728,pNelR-nHz7g,68,90,211,A cooked bird is being cut.,pNelR-nHz7g_68_90,1
90772,DvYN53KBDr0,51,62,29,people destroying a car,DvYN53KBDr0_51_62,1
90919,4xVGpDmA4lE,23,33,159,"A man walking down the street singing is carrying suitcases on his head and a woman, with her arms around his neck, on his back.",4xVGpDmA4lE_23_33,1
91032,4cgzdXlJksU,83,90,94,A girl cuts the tip off a plastic icing squeeze tube with scissors.,4cgzdXlJksU_83_90,1
91140,Zoz0HcCB1vU,0,10,68,Snow dogs are pulling sleds.,Zoz0HcCB1vU_0_10,1
91203,xpOYXbMDDBY,1,20,70,Two men are playing musical instruments.,xpOYXbMDDBY_1_20,1
91283,-9CUm-2cui8,39,44,70,A woman puts four okra in a pan of boiling water.,-9CUm-2cui8_39_44,1
91332,Ne87egvJnWo,0,3,65,A man is breaking bricks with his foot.,Ne87egvJnWo_0_3,1
91507,5YJaS2Eswg0,22,26,33,A girl is skipping rope.,5YJaS2Eswg0_22_26,1
91566,0I4VKj4d0WI,24,40,36,A man is blowing bubbles,0I4VKj4d0WI_24_40,1
91631,R1UrFBF_0iU,35,41,205,A man dressed in a white robe and head gear picks up a man and throws him and then picks up a large board.,R1UrFBF_0iU_35_41,1
91684,F1BwUJ4--Qw,21,38,75,A man dressed as a cowboy quickly shoots various pistols and rifles.,F1BwUJ4--Qw_21_38,1
91748,Ylb4pnW-jP4,102,113,34,A young man running down the stairs.,Ylb4pnW-jP4_102_113,1
91802,nYwbAb0QvBE,195,210,53,A man making sausage balls.,nYwbAb0QvBE_195_210,1
91860,fIaLVw_Gc_w,99,109,26,A woman applying eye shadow.,fIaLVw_Gc_w_99_109,1
92045,MWzeInQaUk4,12,20,80,"A man, accompanied by a band, is singing into a microphone and playing a guitar.",MWzeInQaUk4_12_20,1
92098,5HAf_INrFy0,3,25,82,A cat mimics a boxing match on television.,5HAf_INrFy0_3_25,1
92166,PslVHtXc7Tg,8,14,75,A man driving a car runs into the side of a parked car in a parking lot.,PslVHtXc7Tg_8_14,1
92263,RZL9irxnhZ0,34,40,32,A man is being interviewed.,RZL9irxnhZ0_34_40,1
92326,4ikH9ZRcF2Q,89,105,32,A squirrel is moving in circles.,4ikH9ZRcF2Q_89_105,1
92384,TvBsaMgqh5s,61,68,27,A lady cooking meat in a pan,TvBsaMgqh5s_61_68,1
92451,uAaWVeaYLdQ,1,12,170,A man leaps up into the air and turns with his leg extended and lands in a squat on both feet.,uAaWVeaYLdQ_1_12,1
92576,CwPfvoqmV1Q,58,61,56,A man is doing a wheelie on a motorcycle as he drives in circles.,CwPfvoqmV1Q_58_61,1
92618,wsj_dzz33Ko,31,41,72,A man is cutting leaves.,wsj_dzz33Ko_31_41,1
92696,sm0OYD0NSbQ,51,59,102,A man wearing glasses and a suit is standing and talking in front of a huge bookshelf.,sm0OYD0NSbQ_51_59,1
92748,tYQ7O6V0Fvk,20,55,23,A young boy playing guitar,tYQ7O6V0Fvk_20_55,1
92822,K-KVz3eqbnA,1,10,49,A girl and a boy are eating their food.,K-KVz3eqbnA_1_10,1
92868,i3fd4nE8OCI,174,181,77,Two men appear to be fighting or wrestling.,i3fd4nE8OCI_174_181,1
92978,SZP3Jpbbwj0,52,59,53,A basket ball player does a hook shot on his opponent.,SZP3Jpbbwj0_52_59,1
93020,otvx5OZHTJc,1,22,37,A person is cutting a fish.,otvx5OZHTJc_1_22,1
93094,zxB4dFJhHR8,1,9,41,A girl riding a bicycle along the beach.,zxB4dFJhHR8_1_9,1
93161,s_ldnx8_etY,32,54,64,A whisk mixing an ingredient in a bowl.,s_ldnx8_etY_32_54,1
93223,nau1vCzyFQ4,37,54,22,A man is chopping an onion.,nau1vCzyFQ4_37_54,1
93286,jMO3jGQeqyk,3,6,84,A man in a black and yellow costume chops a chicken in half with an axe.,jMO3jGQeqyk_3_6,1
93346,lo4KcsBN--A,0,10,61,A tortoise chases fish in the ocean.,lo4KcsBN--A_0_10,1
93394,b4mJ3AQc-ag,30,34,39,A piece of chicken is being torn apart.,b4mJ3AQc-ag_30_34,1
93468,QsC8__3lwO0,50,60,1373,A chef seasons a game bird.,QsC8__3lwO0_50_60,1
93545,-s4-6QTT7HE,235,241,100,A man is dancing among a group of women dancers in costumes.,-s4-6QTT7HE_235_241,1
93636,z0zb--BOhDY,16,22,33,A man is rolling dough.,z0zb--BOhDY_16_22,1
93695,aDjNl5gs4nM,18,47,23,A person cutting a up a onion,aDjNl5gs4nM_18_47,1
93769,4eJJF11bIxM,1,9,58,Two girls are talking back and forth on cell phones.,4eJJF11bIxM_1_9,1
93867,ceOXCFUmxzA,100,110,44,A boy and woman are tossing a pumpkin.,ceOXCFUmxzA_100_110,1
93923,CulG2SMC7DU,14,25,80,A woman is lying on a blanket on a rock and reading a book.,CulG2SMC7DU_14_25,1
93974,mYzajpeAWuA,100,112,2198,A..man..plays...a..guitar.,mYzajpeAWuA_100_112,1
94038,OCcy9TDRGKo,118,127,99,Someone is sprinkling cheese on toasted slices of French bread.,OCcy9TDRGKo_118_127,1
94096,yAD_TS5L2d4,4,11,18,A monkey is sitting on carpet scratching itself.,yAD_TS5L2d4_4_11,1
94197,K-czl524zxk,6,15,43,A woman dials a cell phone.,K-czl524zxk_6_15,1
94312,Gm1WnWVXYzQ,0,9,101,A girl carrying books is walking down the street when a man in a jeep stops to talk to her.,Gm1WnWVXYzQ_0_9,1
94363,NZWiKMZS_k8,39,48,42,A girl combs her hair.,NZWiKMZS_k8_39_48,1
94545,_pBeOAMjGm8,1,18,34,A man is playing a guitar.,_pBeOAMjGm8_1_18,1
94642,4kQnrKvOTNg,15,24,225,A puppy is walking down the staircase.,4kQnrKvOTNg_15_24,1
94785,C_DDjCRxTxQ,1,4,88,"Two women are reclining on a couch talking, one woman with her arm around the other.",C_DDjCRxTxQ_1_4,1
94833,MY-rGamtAJc,6,22,28,A cat stares out of the window.,MY-rGamtAJc_6_22,1
94912,ViWQUOGIaSU,9,16,32,A ballerina dances on a stage.,ViWQUOGIaSU_9_16,1
94968,PECk9A-07Pw,1,9,39,A man playing the accordion.,PECk9A-07Pw_1_9,1
95029,5dv8MSWlxoQ,10,40,25,a girl making her hair in a mirror,5dv8MSWlxoQ_10_40,1
95155,ht2oIYBSoI0,9,21,67,A woman is riding a horse inside a track.,ht2oIYBSoI0_9_21,1
95235,6RlYLTU5gvM,18,24,60,A toy train is going around.,6RlYLTU5gvM_18_24,1
95298,jD4o_Lmy6bU,117,137,72,Someone is rolling dough into balls with their hands.,jD4o_Lmy6bU_117_137,1
95587,gqSOvUH_njE,151,155,181,A man with headphones slides down an esculator.,gqSOvUH_njE_151_155,1
95700,cM55xNJ_pfU,1,20,126,A guitar is played.,cM55xNJ_pfU_1_20,1
95762,inLBPVG8oEU,18,24,42,A young man is dancing alone.,inLBPVG8oEU_18_24,1
95812,xEDCfcMZlZY,37,41,16,a man cutting the grass,xEDCfcMZlZY_37_41,1
95929,ggWzbEFC-RE,1,11,20,A toddler is riding a horse.,ggWzbEFC-RE_1_11,1
96012,bAYIIlX-WWw,5,15,107,A man is sitting cross legged playing a wooden flute.,bAYIIlX-WWw_5_15,1
96069,7s0AXJtLL0Y,57,61,1224,A black pet cat is walking in the house.,7s0AXJtLL0Y_57_61,1
96122,lmCrIZeob4w,23,26,51,A group of people sing Christmas carols.,lmCrIZeob4w_23_26,1
96191,5L5MoemWC6g,10,13,21,The couple is kissing.,5L5MoemWC6g_10_13,1
96244,WinaH9SkW9c,11,38,24,A man is riding a horse.,WinaH9SkW9c_11_38,1
96320,MrMG15y3rWU,5,13,1931,A frog attacks someone's finger.,MrMG15y3rWU_5_13,1
96385,nTasT5h0LEg,12,14,56,A cat is on a sofa.,nTasT5h0LEg_12_14,1
96439,eVSQiPbepXg,44,49,38,A woman reading a paper.,eVSQiPbepXg_44_49,1
96508,_JorUS-8Nlg,63,73,110,A bus is being driven down a street with a group of people sitting on it's roof and hanging off the back.,_JorUS-8Nlg_63_73,1
96654,ry7AUQtuwdU,4,39,630,A keyboard is being played.,ry7AUQtuwdU_4_39,1
96726,5JSbxHECb-I,97,110,34,Ingredients are shown being mixed.,5JSbxHECb-I_97_110,1
96788,xlPyHMkpaQY,1,7,469,A person riding a mechanical bull,xlPyHMkpaQY_1_7,1
96923,t4vP-cXXWkY,14,20,150,A long-eared animal with a long tail is hopping.,t4vP-cXXWkY_14_20,1
96975,Ly5D0z9gKtc,15,20,19,Kids are eating burgers in a kitchen.,Ly5D0z9gKtc_15_20,1
97034,nMBSDpB3WB8,5,14,20,A girl is singing.,nMBSDpB3WB8_5_14,1
97423,C9vRgZDxTv4,26,33,32,A man is riding a motorized bike.,C9vRgZDxTv4_26_33,1
97536,sT5Bzt9w354,11,34,28,A person is folding a piece of paper.,sT5Bzt9w354_11_34,1
97602,4D1o4FC8YbA,207,216,38,A woman dances in front of a fire.,4D1o4FC8YbA_207_216,1
97675,Z10_CDPQKKs,1,6,71,A boy jumping on a pogo stick is pushed off by another boy.,Z10_CDPQKKs_1_6,1
97723,JledeVyklPw,1,6,16,A baby sneezes.,JledeVyklPw_1_6,1
97790,iEW-EkPQywU,61,83,19,A girl is chopping up a potato.,iEW-EkPQywU_61_83,1
97851,f_GnkweYzzI,35,41,53,A man throw a brick at a man on the ground.,f_GnkweYzzI_35_41,1
97904,a28s_wyqkyc,68,77,21,A man is running.,a28s_wyqkyc_68_77,1
97972,X0UJaprpxrk,18,26,1324,A Batman & Robin movie clip of them in a helicopter.,X0UJaprpxrk_18_26,1
98087,3n_Kqak2JdA,48,71,46,A man sells goods in store.,3n_Kqak2JdA_48_71,1
98156,ibSwITK4jjQ,14,24,91,A police-man is trying to check someone car.,ibSwITK4jjQ_14_24,1
98222,JM4913Fe-ic,4,15,60,A baby is singing.,JM4913Fe-ic_4_15,1
98285,mZVPkPqwzR4,38,45,11,A group of deer are crossing a road.,mZVPkPqwzR4_38_45,1
98403,SJZFNwfcSOw,3,18,12,A guy is playing guitar.,SJZFNwfcSOw_3_18,1
98456,fnpp8v9NbmY,181,188,43,A demonstration of a recipe is being shown.,fnpp8v9NbmY_181_188,1
98574,Qp-k0H93iJE,35,39,27,Men are playing cricket.,Qp-k0H93iJE_35_39,1
98630,aJoDt4DMkFU,118,124,71,Someone is sewing quilt squares on a sewing machine.,aJoDt4DMkFU_118_124,1
98678,IEQyCcageGg,99,126,45,Several images of rugby players are passing the ball to each other.,IEQyCcageGg_99_126,1
98748,Wv3u2q3oGeU,35,45,39,A man is playing an electric keyboard.,Wv3u2q3oGeU_35_45,1
98796,CGllPWAwmUo,1,15,28,A man plays a violin on the roof of a house.,CGllPWAwmUo_1_15,1
98896,FAD8CbQuvco,35,45,56,A apple being peeled on a cutting board.,FAD8CbQuvco_35_45,1
98942,4wT7zM8XgXQ,5,11,70,A driver crashes out of a parking spot.,4wT7zM8XgXQ_5_11,1
99081,PAN5IVvMlVc,17,23,40,Two girls are dancing.,PAN5IVvMlVc_17_23,1
99175,shPymuahrsc,5,12,81,Some kind of animal is sniffing at a plastic container of something.,shPymuahrsc_5_12,1
99278,Li3umATsU0E,1,5,92,A cat staring into the camera meows.,Li3umATsU0E_1_5,1
99373,bK-i_FAcpoY,86,92,125,"A man in a suit and sunglasses is sitting and smoking a thin cigar, and the smoke is swirling behind his head.",bK-i_FAcpoY_86_92,1
99430,Vn0Xv0fb1z4,18,30,78,"Two lions, seated on a couch, are watching animals on a television.",Vn0Xv0fb1z4_18_30,1
99474,Z3XarHZ3HpY,10,17,28,A tiger runs out of the jungle.,Z3XarHZ3HpY_10_17,1
99535,VU4qLrk5axA,40,58,45,A soccer team practicing drills.,VU4qLrk5axA_40_58,1
99659,-Ms9tsWmhyU,80,95,29,A flute is played.,-Ms9tsWmhyU_80_95,1
99771,dZBIdRGKRhM,13,32,22,Two guys in a night club,dZBIdRGKRhM_13_32,1
99911,r0rmrbTb7fU,98,109,96,A young woman is applying brownish-gold eyeshadow to her eyelid with a brush.,r0rmrbTb7fU_98_109,1
99965,kRNHJSc4AXE,220,228,67,A woman is dancing by a large tree in the rain.,kRNHJSc4AXE_220_228,1
100022,ID2xXlUENG0,19,24,21,motocross bikers racing in a street race,ID2xXlUENG0_19_24,1
100093,XEOH3t5AYY0,22,29,28,A man rides a bicycle.,XEOH3t5AYY0_22_29,1
100165,p9g06ktIkJg,4,11,92,Many raccoon looking animals are huddled in a group.,p9g06ktIkJg_4_11,1
100268,iLr7ZHAq1ro,7,11,47,A yellow train is speeding down a track.,iLr7ZHAq1ro_7_11,1
100365,7uF-2adCsI0,60,67,177,"A woman sits down, opens a can of soft drink, and takes a drink.",7uF-2adCsI0_60_67,1
100521,sv5YlZspb30,10,20,20,The people picked rice in the rice field.,sv5YlZspb30_10_20,1
100589,J_evFB7RIKA,104,120,64,Someone is removing the seeds from a green pepper.,J_evFB7RIKA_104_120,1
100647,AKVBK-0veE8,5,12,32,A person driving a car backs up.,AKVBK-0veE8_5_12,1
100912,b24_bb57PPk,631,637,44,Marlon Wayons serving food at an event.,b24_bb57PPk_631_637,1
100975,TPD5wO_LEPU,2,6,69,A young boy is cleaning a wood floor with a sweeper.,TPD5wO_LEPU_2_6,1
101059,6vC6AT27RUc,29,46,77,A fox or dog wags its tail and smiles.,6vC6AT27RUc_29_46,1
101103,HzYtvOYOEoU,21,32,130,A group of women do a tribal dance.,HzYtvOYOEoU_21_32,1
101388,OfgSCMxttCc,86,92,79,A man is holding up and talking about a gray You Tube T-shirt.,OfgSCMxttCc_86_92,1
101432,JMUAylpXzG0,45,62,70,A woman is cutting pieces from a cake.,JMUAylpXzG0_45_62,1
101495,BLXzfdNmydQ,151,156,37,A girl riding a horse.,BLXzfdNmydQ_151_156,1
101547,zulPFoY64wE,26,33,69,A man is riding a horse by some water and a woman's head comes out of the water.,zulPFoY64wE_26_33,1
101603,p3J3TAdKAYQ,0,10,18,A cat is eating food.,p3J3TAdKAYQ_0_10,1
101665,Dgf0VHMEtNs,57,66,69,Four people in surgical masks are operating on a man.,Dgf0VHMEtNs_57_66,1
101778,u4T76jsPin0,0,11,82,Eight men are running a race on a track.,u4T76jsPin0_0_11,1
101964,pcjuCotJYj8,50,62,46,A newscaster is paddling in a boat.,pcjuCotJYj8_50_62,1
102038,MwOEK-KXSPc,1,10,198,A monkey is brushing the hair of a large white dog.,MwOEK-KXSPc_1_10,1
102123,N3A7944_UJw,63,70,46,A chef cooking food,N3A7944_UJw_63_70,1
102190,4-1gpwkD7Hc,7,15,39,A group of turtles crawls across the sand.,4-1gpwkD7Hc_7_15,1
102358,QMJY29QMewQ,42,52,55,Eggs are being prepared for a meal.,QMJY29QMewQ_42_52,1
102430,Ffv7fhL1EDY,177,184,86,Two teams of men are playing soccer on a grass field.,Ffv7fhL1EDY_177_184,1
102614,swJ0zhVJ8DU,15,21,68,People are disembarking from a train.,swJ0zhVJ8DU_15_21,1
102663,8HB7ywgJuTg,131,142,154,"Someone seasons rice in a skillet with a white substance, and another person stirs the mixture with a spatula.",8HB7ywgJuTg_131_142,1
102724,k5OKBX2e7xA,19,32,12,A man is doing motorcycle tricks.,k5OKBX2e7xA_19_32,1
102784,8CzlhZtunNc,5,11,81,A baby snow leopard sitting in front of an adult snow leopard runs off.,8CzlhZtunNc_5_11,1
102837,G-M78KIy19E,315,330,142,A man is felling a tree.,G-M78KIy19E_315_330,1
102964,xkNDE1JL6Z8,50,59,155,a man playing football,xkNDE1JL6Z8_50_59,1
103055,WV9K6MbLjHA,106,116,360,One man is riding a horse in a field.,WV9K6MbLjHA_106_116,1
103204,fY0lZTWlBAg,470,485,32,A woman is stepping side to side.,fY0lZTWlBAg_470_485,1
103343,MICawzo1MqI,3,13,47,A man is making a call on his mobile.,MICawzo1MqI_3_13,1
103402,DcDYRpa34W8,11,25,10,A baby is laughing.,DcDYRpa34W8_11_25,1
103461,9VG7Elw9TDA,85,91,49,A man and a woman are kissing.,9VG7Elw9TDA_85_91,1
103558,5fq9iIxxA1s,12,27,65,A boy is calling another to pass football.,5fq9iIxxA1s_12_27,1
103702,5EXVeP6R3yc,105,108,76,A man emerges out of a puddle of muddy water.,5EXVeP6R3yc_105_108,1
103757,qOiN__I1-Zo,2,8,31,A dog barks at a walking electronic chicken.,qOiN__I1-Zo_2_8,1
103988,5fDBl1wT2Lk,34,39,47,A big ball bounces over a nut.,5fDBl1wT2Lk_34_39,1
104061,bnN_o0Hkn3M,73,80,23,A man shoots two different guns.,bnN_o0Hkn3M_73_80,1
104129,FvfjDQj5sOY,1,10,52,A boy is playing a guitar and other boy is listing to its.,FvfjDQj5sOY_1_10,1
104232,1Dty_eGY9Ec,123,133,30,A man getting face painted by a woman artist,1Dty_eGY9Ec_123_133,1
104296,gtixLEvO2Us,0,6,21,A woman is dancing.,gtixLEvO2Us_0_6,1
104373,muI1BFsdbdo,33,45,18,The men are running a race.,muI1BFsdbdo_33_45,1
104418,mtrCf667KDk,134,176,26,a person cutting up a fruit,mtrCf667KDk_134_176,1
104474,x8Ul09tk6zk,0,8,58,"A person practices a foul shot in the gym, and makes it!",x8Ul09tk6zk_0_8,1
104578,wkgGxsuNVSg,34,41,31,A fishing is chasing a boy.,wkgGxsuNVSg_34_41,1
104747,p69Q8lTkZTc,21,29,56,A man in a loosing attempt to hitchhike.,p69Q8lTkZTc_21_29,1
104817,7EOqi_6rnkg,36,44,60,A man in a gorilla suit plays a bongo in a shopping center.,7EOqi_6rnkg_36_44,1
104872,R0e8ojL0vcc,8,14,31,A chef cutting banana bread,R0e8ojL0vcc_8_14,1
104939,bDoCQEwghZU,201,211,22,A man is spinning in a chair.,bDoCQEwghZU_201_211,1
104998,qew09qQgMAg,22,27,37,A man is crawling with a ice cream cone in hand.,qew09qQgMAg_22_27,1
105053,ulPvRmNfXK4,96,100,251,A man holding an umbrella has jumped a hurdle and a wall.,ulPvRmNfXK4_96_100,1
105130,Tm1HjqK0ABg,9,15,62,A boy is skateboarding in a busy city area.,Tm1HjqK0ABg_9_15,1
105183,TFJ6oR89Vb8,90,107,622,An omelet is being cooked in a pan.,TFJ6oR89Vb8_90_107,1
105247,iUYWdCxvJCI,2,14,19,a baby playing in the living room,iUYWdCxvJCI_2_14,1
105322,vpR0L3sIvoo,15,49,51,A cat jumps frantically in the air.,vpR0L3sIvoo_15_49,1
105438,HmVPxs4ygMc,44,53,39,Paper is being ripped apart.,HmVPxs4ygMc_44_53,1
105511,lFdg5CWMTt0,24,28,28,The man used a hammer to hit his hand.,lFdg5CWMTt0_24_28,1
105683,HAjwXjwN9-A,16,24,67,"Women, with numbers on their backs, are skating in a roller derby.",HAjwXjwN9-A_16_24,1
105837,m1c04pCYGxA,57,64,26,a woman climbing a mountain,m1c04pCYGxA_57_64,1
106129,jmoT2we_rqo,0,5,68,A basket ball player does a left handed lay-up.,jmoT2we_rqo_0_5,1
106230,pW9DFPqoIsI,26,50,65,a person writing opening a package,pW9DFPqoIsI_26_50,1
106351,Mutb8BHFvzk,15,20,34,A man breaks an apple in half with his hands.,Mutb8BHFvzk_15_20,1
106475,PqvKNqkGI9o,47,52,120,Four men are fighting and one man throws an armed man over his shoulder onto the ground.,PqvKNqkGI9o_47_52,1
106623,1QVn0FffExM,14,24,21,A lion is licking his chops.,1QVn0FffExM_14_24,1
106700,z_qf7tOnHVg,81,89,30,A man is eating a banana.,z_qf7tOnHVg_81_89,1
106823,zS50h-a8RTg,3,9,27,A man dives into the pool.,zS50h-a8RTg_3_9,1
107160,Cx1We6GX4IM,0,8,26,A dog is staring and wagging it's tail.,Cx1We6GX4IM_0_8,1
107413,oG6LLGi_n48,51,55,18,a kid falling out a bike,oG6LLGi_n48_51_55,1
107535,rlQ2kW-FvMk,66,79,75,A man is instructing or describing a woman who is exercising.,rlQ2kW-FvMk_66_79,1
107655,IBgsLmDcL78,80,84,348,A man slicing butter into a bowl.,IBgsLmDcL78_80_84,1
107726,Sj6GSmDpNDw,0,12,29,A group of couples are dancing in an event.,Sj6GSmDpNDw_0_12,1
107782,UhI-p6AysWY,25,30,19,a white cat licking his tongue,UhI-p6AysWY_25_30,1
107845,C12BRGGcd5E,101,117,45,A lady is talking and washing her hands.,C12BRGGcd5E_101_117,1
108049,sZf3VDsdDPM,107,114,75,A man and a woman are sitting down eating with forks.,sZf3VDsdDPM_107_114,1
108104,1dYpcVv6n3Y,0,18,182,"A diapered baby is standing holding onto a coffee table and dancing, trying to mimic the three women he is watching dance on television.",1dYpcVv6n3Y_0_18,1
108272,Xvy21KrDv8I,0,10,69,A badger climbs out of a hole and walks down a path.,Xvy21KrDv8I_0_10,1
108333,hksxtbcS780,7,14,81,Two pandas are snuggling.,hksxtbcS780_7_14,1
108441,nLvX-erABqY,67,72,36,A cartoon bunny kisses another bunny.,nLvX-erABqY_67_72,1
108487,cwkjJrGpoaU,30,41,51,A man cuts a slab of meat.,cwkjJrGpoaU_30_41,1
108657,IWhrWLOAin0,1,4,52,A large dog gets something out of a refrigerator.,IWhrWLOAin0_1_4,1
108709,JnNe61UZsdM,78,88,74,A blond woman in a slinky gown is dancing.,JnNe61UZsdM_78_88,1
108865,9fkS7wqrzAY,13,25,21,A boy is playing a cello.,9fkS7wqrzAY_13_25,1
108928,tmAX2PnRCY0,284,292,23,The person is pouring coconut water.,tmAX2PnRCY0_284_292,1
109040,06CbMa0kDr8,3,13,89,Someone is feeding a red panda cub out of the palm of his hand.,06CbMa0kDr8_3_13,1
109085,fd7Ky1lEPT8,40,50,31,a man cutting up a fruit,fd7Ky1lEPT8_40_50,1
109160,BefkDBj5gSw,104,109,45,A man is walking down a stone path.,BefkDBj5gSw_104_109,1
109202,ZnLgsasu82g,71,81,53,A boy rides a bike on a fence.,ZnLgsasu82g_71_81,1
109271,bxjFqtfJlMs,18,27,301,A man adds some salt and black pepper powder to a bowl containing poultry seasoning and mixes the three ingredients with a spoon.,bxjFqtfJlMs_18_27,1
109347,ZYaxg5NZW_g,21,27,29,A baby monkey is eating.,ZYaxg5NZW_g_21_27,1
109402,p6cg2jWI34M,34,42,42,Three white lion cubs sniff each other.,p6cg2jWI34M_34_42,1
109467,X56XkGFe7OY,47,61,52,A bunch of raccoons are eating peanuts.,X56XkGFe7OY_47_61,1
109541,OxL9z2BzBnk,0,19,37,A small puppy wagging it's tail.,OxL9z2BzBnk_0_19,1
109608,d-2C_N5anww,1,3,104,A dog running down a road runs into a brick mailbox.,d-2C_N5anww_1_3,1
109665,NMlKMfiHSho,1,15,154,A cat is trying to use it's mouth and paws to get a small plastic bottle someone is holding.,NMlKMfiHSho_1_15,1
109707,O9cOSO9L8Zs,1,16,21,A man is swinging on a rope.,O9cOSO9L8Zs_1_16,1
109781,Ce7equ9zCxk,4,19,62,"A phone is off the hook, and a bird appears to be dialing it with it's beak.",Ce7equ9zCxk_4_19,1
109825,po2tcrG6KzM,2,8,28,A person is playing the keyboard.,po2tcrG6KzM_2_8,1
109935,LSuVRWPoHr0,0,37,214,A carrot being sliced and diced.,LSuVRWPoHr0_0_37,1
109995,Yh2N6ZtRBdU,110,120,88,A man seated on a park bench is rocking a woman seated on his lap.,Yh2N6ZtRBdU_110_120,1
110038,Vg1jyL3cr60,163,186,38,A group is playing musical instruments.,Vg1jyL3cr60_163_186,1
110220,RiglOfJon8I,3,18,24,A soccer player arguing with a referee.,RiglOfJon8I_3_18,1
110284,gbW9f8xydks,0,10,188,Two animals are eating what appears to be apple slices from a pan within a cage.,gbW9f8xydks_0_10,1
110404,JktNQQnLblQ,4,9,643,A cartoon of a woman flipping a pancake.,JktNQQnLblQ_4_9,1
110549,E61HNXjgyqA,22,32,73,A woman wearing a headset is singing into a large microphone.,E61HNXjgyqA_22_32,1
110586,HYbEf-JKZnA,13,26,105,"Using a knife, a man cuts through a row of bottles that are full of water.",HYbEf-JKZnA_13_26,1
110665,hxZ-5wELSJM,0,12,62,Two men are playing table tennis in front of an audience.,hxZ-5wELSJM_0_12,1
110907,kBMsuhDvg88,45,64,43,A group of people create a human pyramid.,kBMsuhDvg88_45_64,1
111075,yPNFVj-pISU,105,115,32,A car stops to pick up a hitchhiker.,yPNFVj-pISU_105_115,1
111132,Qjbcibrv3L0,26,32,285,There is a view of a pilot in the cockpit of a jet airplane and then the scene switches to a view of exterior of the jet flying.,Qjbcibrv3L0_26_32,1
111198,cUW_bXll6YM,390,395,144,Someone pours olive oil into a bowl of tomato wedges.,cUW_bXll6YM_390_395,1
111264,6QbhfbLUtQs,13,23,26,A bucket of green slime is poured on top of a woman's head.,6QbhfbLUtQs_13_23,1
111322,Puv_4NtflqE,26,34,65,Someone is pouring oil from a plastic bottle into a skillet.,Puv_4NtflqE_26_34,1
111492,jTnrm338_KY,34,42,20,A woman is picking up a reptile.,jTnrm338_KY_34_42,1
111539,akXjIEoecNs,2,12,29,A man is playing the key board.,akXjIEoecNs_2_12,1
111609,c2MwqFYVE7A,40,45,31,A man shoots at a target.,c2MwqFYVE7A_40_45,1
111674,jPBxl9gFqNY,110,117,708,A chef pours oil into a pot.,jPBxl9gFqNY_110_117,1
111742,64Xn9edeWRA,0,11,135,A cat sitting on the back edge of a couch jumps up and is rotated around a ceiling fan then tossed off.,64Xn9edeWRA_0_11,1
111799,hoinj6vyQ2g,8,16,76,A young man is playing a guitar.,hoinj6vyQ2g_8_16,1
111975,e4QGnppJ-ys,6,14,74,A man is skateboarding on a half pipe and he tries to do a flip and fails.,e4QGnppJ-ys_6_14,1
112044,rl1rVk_xIOs,1,16,14,Children are dancing.,rl1rVk_xIOs_1_16,1
112086,EPgQ9QwbsLE,16,23,23,a boy playing with two frogs,EPgQ9QwbsLE_16_23,1
112212,UI3Cbj9fbxQ,2,23,58,A woman unsuccesfully attempts to change a flat tire.,UI3Cbj9fbxQ_2_23,1
112339,tn1d5DmdMqY,15,28,239,A man is playing a guitar.,tn1d5DmdMqY_15_28,1
