,VideoID,Start,End,AnnotationTime,Description,true_id,Tenemos video
18,mv89psg6zh4,33,46,66,A bird in a sink keeps getting under the running water from a faucet.,mv89psg6zh4_33_46,1
56,ZbzDGXEwtGc,6,15,24,a plane flying in the sky,ZbzDGXEwtGc_6_15,1
125,jbzaMtPYtl8,48,58,203,Two men are rolling huge tires sideways down a street while spectators watch.,jbzaMtPYtl8_48_58,1
176,g36ho6UrBz0,5,20,28,a man playing a guitar outside his house,g36ho6UrBz0_5_20,1
251,04Gt01vatkk,248,265,33,A woman cuts an oion.,04Gt01vatkk_248_265,1
305,buJ5HDCinrM,150,166,128,A woman is putting make up on her face.,buJ5HDCinrM_150_166,1
387,M_TP6UTrh30,343,358,37,A band is performing for a large crowd.,M_TP6UTrh30_343_358,1
445,8mSUD7JGNO0,174,181,26,A woman gallops on a horse.,8mSUD7JGNO0_174_181,1
531,ljGcQocjSs4,38,60,15,A guy is shooting a gun.,ljGcQocjSs4_38_60,1
594,n2NLoLNecgI,168,178,15,A girl is playing violin.,n2NLoLNecgI_168_178,1
660,6q1dX6thX3E,286,295,35,A man is talking on the phone.,6q1dX6thX3E_286_295,1
716,mFCf8lLXrUc,25,35,75,A person is peeling a mango.,mFCf8lLXrUc_25_35,1
783,6eokrw6_bjU,1,9,26,A woman is firing a rifle.,6eokrw6_bjU_1_9,1
862,E2r6nnkwl0c,6,18,15,A group of boys are jumping into a river.,E2r6nnkwl0c_6_18,1
911,n016q1w8Q30,2,11,27,Cards are being shuffled.,n016q1w8Q30_2_11,1
976,rQuNYxNmA6M,0,4,51,A baseball player throwing ball.,rQuNYxNmA6M_0_4,1
1022,ByGspTdA1ug,16,24,76,A person is sliding a cat across the floor.,ByGspTdA1ug_16_24,1
1078,-_hbPLsZvvo,323,328,9,A man is arranging sushi.,-_hbPLsZvvo_323_328,1
1135,6t0BpjwYKco,217,229,61,A woman seasons both sides of a pork chop.,6t0BpjwYKco_217_229,1
1175,MTkGPfMRXtc,5,21,32,Rubber band trouble.,MTkGPfMRXtc_5_21,1
1222,aeA-HN7BMdo,34,41,48,a women cutting broccoli up,aeA-HN7BMdo_34_41,1
1287,WWf0Z6ak3Dg,5,15,27,A bulldog is chasing a large blue ball around a yard.,WWf0Z6ak3Dg_5_15,1
1357,DBvSfds3FH4,76,80,37,A woman is kneading dough.,DBvSfds3FH4_76_80,1
1406,Ms3QdGIzltU,1,16,173,A brown Hamster is eating some nutshells placed on a table.,Ms3QdGIzltU_1_16,1
1479,nS6oQxX_Qi8,2,12,61,A young man is playing the trumpet.,nS6oQxX_Qi8_2_12,1
1549,pDvzOLRLjPc,0,8,24,A person is feeding two baby pandas.,pDvzOLRLjPc_0_8,1
1607,LQ-jv8g1YVI,1,6,21,A cat is on a robot.,LQ-jv8g1YVI_1_6,1
1677,kquB3rIgfGk,640,645,27,A man drinks a glass of water.,kquB3rIgfGk_640_645,1
1730,BVjvRpmHg0w,157,165,46,A woman is cutting broccoli.,BVjvRpmHg0w_157_165,1
1798,QzcTlEpAigQ,0,14,24,A beagle is peeing off a boat into the water.,QzcTlEpAigQ_0_14,1
1892,AysIdzGF-7M,6,14,29,A kitten plays with string.,AysIdzGF-7M_6_14,1
1939,iwpnUHFhjWc,9,14,34,A woman is dancing outside.,iwpnUHFhjWc_9_14,1
2068,bJJndejsUWc,88,98,100,A band is performing on stage with fire in the background.,bJJndejsUWc_88_98,1
2133,Xh6rdpJNaf0,0,15,84,A bunny is licking itself.,Xh6rdpJNaf0_0_15,1
2230,nwk4m329bLw,2,10,65,A man is walking in a field near a wooded area with four dogs.,nwk4m329bLw_2_10,1
2300,ItFqogTmAvQ,389,395,80,A woman and a man are holding hands and running towards the ocean.,ItFqogTmAvQ_389_395,1
2356,PCXHuseKwDc,17,20,81,A man is pouring antifreeze from a large jug into a funnel into his car.,PCXHuseKwDc_17_20,1
2402,9Bxknsvy3jQ,53,58,145,"A young man skateboards along a step, up a ramp, and then does a flip onto the pavement above.",9Bxknsvy3jQ_53_58,1
2446,a1Y73sPHKxw,0,5,31,"While standing on its hind legs, a prairie dog turns to look at the camera.",a1Y73sPHKxw_0_5,1
2575,C1MNCR1o9lU,0,7,847,A woman bottle feeds a baby.,C1MNCR1o9lU_0_7,1
2636,zzit5b_-ukg,5,20,67,A boy is doing exercise by cycle.,zzit5b_-ukg_5_20,1
2701,w9mqbwOIkVg,6,12,37,A man is doing a weight exercise.,w9mqbwOIkVg_6_12,1
2755,lAznAeFFldg,6,10,60,A man rides a bike over a hill in the woods.,lAznAeFFldg_6_10,1
2818,VF1K_6ZSOAY,23,28,77,A woman is writing at a desk and a small box slowly moves toward her.,VF1K_6ZSOAY_23_28,1
2875,j2Dhf-xFUxU,13,20,94,Someone is cutting a stack of crisp tortillas into quarters.,j2Dhf-xFUxU_13_20,1
2930,_txL575S_OA,13,23,295,A dazzle of zebras are grazing on grassland.,_txL575S_OA_13_23,1
2998,E6sqA9QtV5I,195,201,100,"A man, with tatoos on his arm, is kissing a woman.",E6sqA9QtV5I_195_201,1
3049,XzCcRzEa83U,1,8,20,The monkey pushed the other monkey.,XzCcRzEa83U_1_8,1
3098,8jP8CC2rKj4,80,88,43,A dolphin jumps out of water.,8jP8CC2rKj4_80_88,1
3180,HBCJYhUjVf0,0,9,69,A lion jumps and hangs off the top of a fence in an enclosed area.,HBCJYhUjVf0_0_9,1
3266,n6U-TGahwvs,100,110,20,A band is performing a song,n6U-TGahwvs_100_110,1
3340,Uc63MFVwfrs,360,372,68,Someone is cutting a cooked potato into bite-size pieces.,Uc63MFVwfrs_360_372,1
3384,bQJQGoJF7_k,109,115,47,A man is pouring seasoning in a plastic container.,bQJQGoJF7_k_109_115,1
3430,3SKyc0aKx70,46,52,33,A boy does flips on a trampoline.,3SKyc0aKx70_46_52,1
3629,PuQVs2Ch1LY,5,15,47,A girl wearing glasses is playing the flute.,PuQVs2Ch1LY_5_15,1
3680,elQqQfux7Po,12,22,76,A dog is eating a slice of watermelon someone is holding over a plate.,elQqQfux7Po_12_22,1
3731,zFIn8DeV5PM,20,33,26,a person playing a piano,zFIn8DeV5PM_20_33,1
3813,dEn5E-TNezw,13,23,124,A small hedgehog is on a table chewing on a towel with his mouth.,dEn5E-TNezw_13_23,1
3862,J3_hkgu6MGc,43,52,81,"A car driven down the street at night stops, and people start to get out.",J3_hkgu6MGc_43_52,1
3919,q9ew_nITQWY,54,62,58,Two teams are playing cricket.,q9ew_nITQWY_54_62,1
3979,6owu8Mow0_g,302,307,13,A man puts cheese on a pizza.,6owu8Mow0_g_302_307,1
4042,WTf5EgVY5uU,98,104,18,A woman breaks an egg.,WTf5EgVY5uU_98_104,1
4111,9W6aQNcU3PA,92,103,17,The lady is filing her nails.,9W6aQNcU3PA_92_103,1
4168,bXsKw3TOQXs,30,55,151,A small piece of paper is being folded.,bXsKw3TOQXs_30_55,1
4230,5W02895vT8c,312,322,14,A plane is taking off.,5W02895vT8c_312_322,1
4288,PHDmVhShE80,20,29,24,The woman is cutting a tentacle.,PHDmVhShE80_20_29,1
4405,xxHx6s_DbUo,41,44,72,A man is carrying another man piggyback.,xxHx6s_DbUo_41_44,1
4462,DIebwNHGjm8,133,148,47,a girl in  the ocean on jet skii,DIebwNHGjm8_133_148,1
4583,39Ce7I6nXIw,96,104,939,A man walks his horse.,39Ce7I6nXIw_96_104,1
4721,0lh_UWF9ZP4,50,60,86,A woman is adding and stirring in three different ingredients into a bowl of cooked white rice.,0lh_UWF9ZP4_50_60,1
4775,BVilbVCo9sU,1,11,69,A large cat is watching and sniffing a spider.,BVilbVCo9sU_1_11,1
4810,OUII8_aOfNM,60,69,15,A butcher cutting up meat.,OUII8_aOfNM_60_69,1
4870,JK1R9k1WDpc,6,15,138,A herd of elephants are walking single file down a path.,JK1R9k1WDpc_6_15,1
4924,u4kMN1jamdM,10,20,71,A woman riding a horse on the beach.,u4kMN1jamdM_10_20,1
4989,7NNg0_n-bS8,21,30,26,A man is singing and playing a guitar.,7NNg0_n-bS8_21_30,1
5054,UXs3eq68ZjE,255,260,67,Someone is stirring rice in a kettle of water with a wooden spoon.,UXs3eq68ZjE_255_260,1
5173,wjH72cZ0GLM,1,10,13,A man is pushing a car.,wjH72cZ0GLM_1_10,1
5221,32_A0-er4Ws,16,20,36,a  woman picking a tomatoes,32_A0-er4Ws_16_20,1
5288,vE1gvaM3iAs,39,46,65,A gloved individual wipes off a dvd.,vE1gvaM3iAs_39_46,1
5340,MF88IYF2MHY,25,59,41,An angry cat hissing and scratching.,MF88IYF2MHY_25_59,1
5411,H7vezmDeZaw,2,7,28,The man ran and hit the wall.,H7vezmDeZaw_2_7,1
5473,BAf3LXFUaGs,28,38,15,The man is playing the drums.,BAf3LXFUaGs_28_38,1
5527,80D0ylOqPJ8,0,5,68,A dog is walking on his front two legs with his hind legs in the air.,80D0ylOqPJ8_0_5,1
5590,ywMLb2VfHbI,13,20,14,A gerbil is running in his wheel.,ywMLb2VfHbI_13_20,1
5646,XZ0Ch_ClBfo,120,127,59,Three men run into and play in the ocean.,XZ0Ch_ClBfo_120_127,1
5697,gMqKUPeTAkg,17,30,31,a cat drinking water out the sink,gMqKUPeTAkg_17_30,1
5768,PmrTDZy3f2M,35,39,56,Two men are slam-dunking basketballs into basketball hoops.,PmrTDZy3f2M_35_39,1
5809,S-Civm_fbK8,20,26,34,A man kicks a soccer ball into the net.,S-Civm_fbK8_20_26,1
5884,BtQtRGI0F2Q,15,20,166,"Several men or working at the top of a utility pole, when one man gets electrocuted then hangs upside down.",BtQtRGI0F2Q_15_20,1
5938,o_mWZWcm2r4,10,15,77,Two people are climbing up a wall using protective gear.,o_mWZWcm2r4_10_15,1
5991,j2sOMdilDWU,87,97,49,A man is drawing something on a piece of paper.,j2sOMdilDWU_87_97,1
6043,hcCLIzzB1jQ,1,7,69,A man in a suit is doing one-handed push-ups.,hcCLIzzB1jQ_1_7,1
6097,hJFBXHtxKIc,204,209,78,Someone pours a reddish liquid into a saucepan of sausage from a large glass jug.,hJFBXHtxKIc_204_209,1
6149,5K7Ru5s6YIw,8,11,39,A kangaroo nibbles on it's food.,5K7Ru5s6YIw_8_11,1
6228,-wa0umYJVGg,168,176,77,A woman is adding green leaves to a pot of boiling water.,-wa0umYJVGg_168_176,1
6283,klteYv1Uv9A,27,33,87,A man is lying back on a moving motorcycle.,klteYv1Uv9A_27_33,1
6339,swKrHEeOj9c,4,8,57,A white cat is facing a wall and appears to be talking.,swKrHEeOj9c_4_8,1
6384,qBFSt85-xqk,15,20,47,Milk is being into a huge bowl of eggs.,qBFSt85-xqk_15_20,1
6429,z9qbQX4J_2g,0,14,41,A group of kids singing on stage.,z9qbQX4J_2g_0_14,1
6501,AjZ-R3LFMzo,18,23,180,A motorcycle rider is shown performing stunts on his motorcycle.,AjZ-R3LFMzo_18_23,1
6580,WPG-BIWOrG4,672,677,63,A man is slicing open a fish longways with a knife.,WPG-BIWOrG4_672_677,1
6628,FWzsXeXCwuc,106,110,54,A monkey is climbing at the head of a statue.,FWzsXeXCwuc_106_110,1
6727,m1NR0uNNs5Y,160,166,67,A woman is peeling cloves of garlic with her hands.,m1NR0uNNs5Y_160_166,1
6785,yC4eEuURH8c,19,28,69,A kitten is running back and forth on a bed meowing.,yC4eEuURH8c_19_28,1
6845,30GeJHYoerk,80,85,73,A young woman is roller skating around small orange cones.,30GeJHYoerk_80_85,1
6893,aRo8x3xXeEA,3,8,17,The snowboarder is doing tricks.,aRo8x3xXeEA_3_8,1
6951,-rvjK0lE3z4,33,43,76,Someone cuts a potato into cube-size pieces with a knife.,-rvjK0lE3z4_33_43,1
6992,yyxtyCaEVqk,329,360,26,A man demonstrating how to season carrots.,yyxtyCaEVqk_329_360,1
7126,Q-soOsOLIGQ,0,22,67,A man is instructing a boy about batting.,Q-soOsOLIGQ_0_22,1
7182,msCidKHOh74,410,418,305,A man is riding a motorcycle.,msCidKHOh74_410_418,1
7252,NjCqtzZ3OtU,303,307,42,A woman places a small box in her mouth.,NjCqtzZ3OtU_303_307,1
7321,v-9Gx0gJmfo,91,99,103,A woman paddles a canoe and then disembarks.,v-9Gx0gJmfo_91_99,1
7383,8MVo7fje_oE,113,118,59,Someone sets the timer and starts a microwave oven.,8MVo7fje_oE_113_118,1
7432,Lt1JijkvSKk,0,10,180,An animal sitting on someone's lap in a car is playing with a small object on a chain attached to the window.,Lt1JijkvSKk_0_10,1
7481,_O9kWD8nuRU,25,35,241,A woman is cutting a yellow vegetable-looking substance into pieces.,_O9kWD8nuRU_25_35,1
7534,oFUsn1owAbs,158,168,71,A woman is taking a bubble bath in a large black tub.,oFUsn1owAbs_158_168,1
7585,Ea0thGZKPXA,25,35,35,A boy is playing a flute.,Ea0thGZKPXA_25_35,1
7654,lsanQj2yacs,102,108,99,"Two girls are standing at a kitchen counter, where one girl is spreading mayonnaise on two slices of bread.",lsanQj2yacs_102_108,1
7707,OpR1Er5o6IY,209,217,30,A man dangles a mouse for a snake to eat.,OpR1Er5o6IY_209_217,1
7770,IhwPQL9dFYc,61,75,59,A woman dices a potato into tiny pieces with a knife.,IhwPQL9dFYc_61_75,1
7938,qRoxNXm7INc,58,66,76,Someone is rubbing the head of a cat lying down.,qRoxNXm7INc_58_66,1
8033,16iNk1hLJt4,37,40,196,Six young runners are lined up at the starting line of a racetrack waiting for a man to tell them to start.,16iNk1hLJt4_37_40,1
8077,ZdlG8fjGJlo,78,87,89,Someone cuts a piece of green pepper in half and adds to a blender containing tomatoes.,ZdlG8fjGJlo_78_87,1
8138,lfGlDg47How,361,367,59,A man is using an electric whisk.,lfGlDg47How_361_367,1
8185,c2a0GcoJAjw,107,129,52,Two women are doing a dance routine.,c2a0GcoJAjw_107_129,1
8265,O06WXS_XZN0,0,6,37,A man is petting a tied up dog.,O06WXS_XZN0_0_6,1
8338,47D9-U8hn5I,11,16,122,"A cat, with socks on it's paws, slides with each step across a coffee table and eventually slides off the table.",47D9-U8hn5I_11_16,1
8457,c51L6ZxZGjQ,137,154,118,A woman is spreading butter on large pieces of bread with a metal spatula.,c51L6ZxZGjQ_137_154,1
8508,-vKO3uSG6Do,3,14,69,Three animated women are synchronized dancing.,-vKO3uSG6Do_3_14,1
8549,vfktGc_qx-w,2,18,52,Two people are doing tricks on a motorcycle.,vfktGc_qx-w_2_18,1
8573,zSPBC8EO6dY,122,126,53,Two men greet a pilot.,zSPBC8EO6dY_122_126,1
8632,s7znbqra118,91,97,970,A band marches in a parade.,s7znbqra118_91_97,1
8697,Tied-t1fFsk,15,20,23,A man is shooting a gun.,Tied-t1fFsk_15_20,1
8770,u9prcUCHlqM,73,80,112,A man is talking while walking outdoors carrying a black shoulder bag and a tripod over his shoulder.,u9prcUCHlqM_73_80,1
8822,aHiUM8uWxxo,17,25,33,two boys flying a toy airplane,aHiUM8uWxxo_17_25,1
8901,mF6ijhSrbBQ,32,40,19,An otter is sliding on ice.,mF6ijhSrbBQ_32_40,1
8957,rw9h_574HxE,229,236,59,A man has his arm around a woman and they are walking in the woods.,rw9h_574HxE_229_236,1
9009,_WRC7HXBJpU,414,425,35,A man is adding water to a pan.,_WRC7HXBJpU_414_425,1
9074,9OvXb1fot74,21,29,29,A flash advertisement.,9OvXb1fot74_21_29,1
9132,vZa13vJugGU,0,30,59,A man is playing a guitar with his feet.,vZa13vJugGU_0_30,1
9204,r4qv_BNlQNk,93,98,425,A boy puts a large piece of bark into his mouth.,r4qv_BNlQNk_93_98,1
9252,dfOuTx66bJU,34,39,141,"A man walking down the street turns around, then turns back and starts jogging.",dfOuTx66bJU_34_39,1
9310,giLxPCgLLqg,9,19,58,A man catches the ball in a game of cricket.,giLxPCgLLqg_9_19,1
9379,e996zZ0uV_A,152,163,55,A boy is adding juice in the cup.,e996zZ0uV_A_152_163,1
9427,Ar70p1_LcfM,2,20,36,a kid playing on a computer,Ar70p1_LcfM_2_20,1
9456,Kxa0mnDj0bs,113,124,257,A polar bear has placed its chin and fore limbs on the snow and is moving ahead by walking on its hind legs.,Kxa0mnDj0bs_113_124,1
9519,ZlX_Gy4HP2E,38,55,24,A woman demonstrating a walking exercise.,ZlX_Gy4HP2E_38_55,1
9595,fr9H1WLcF1A,326,336,64,Many boys in a fenced yard are fighting with toy swords.,fr9H1WLcF1A_326_336,1
9633,GPyFZMJ5Dow,56,70,35,A man prepares hamburger.,GPyFZMJ5Dow_56_70,1
9695,ZN2_czSBSD0,240,250,29,A man is running towards a tornado in an open field.,ZN2_czSBSD0_240_250,1
9765,v7NpKUVqjpI,23,40,22,elephant and trainers in the jungle,v7NpKUVqjpI_23_40,1
9900,UbmZAe5u5FI,16,23,43,A woman is thinly slicing a cucumber with a knife.,UbmZAe5u5FI_16_23,1
9943,s1ZABV7AQdA,38,48,34,A man gets chased by a stampede of people.,s1ZABV7AQdA_38_48,1
10004,_7nP9z6T9m8,11,17,52,A bicyclist hits his face on a road sign.,_7nP9z6T9m8_11_17,1
10067,3ytUOoa1SBE,12,23,56,Many performers in costumes on stage are dancing.,3ytUOoa1SBE_12_23,1
10122,_o1UXSxTjfo,68,80,265,A man bags produce and talks to a group.,_o1UXSxTjfo_68_80,1
10189,hW8TKz2Aea4,5,12,63,Someone is holding a hedgehog in their hand.,hW8TKz2Aea4_5_12,1
10233,V6Fxclwdfxc,56,66,197,A bird carries his ball up a ladder.,V6Fxclwdfxc_56_66,1
10277,jlahRlo4jlU,30,36,16,A man is walking down a road.,jlahRlo4jlU_30_36,1
10356,QT8iCDc7NGU,18,23,76,"A woman, wearing yellow rubber gloves, is talking while washing the top of a chest freezer with a cloth.",QT8iCDc7NGU_18_23,1
10405,p69d3UBdpR8,98,109,19,A young Asian girl is applying eyeliner.,p69d3UBdpR8_98_109,1
10482,nBFhvrAOFqY,89,103,36,An orangutan is stripping his clothes.,nBFhvrAOFqY_89_103,1
10545,ysTmUTQ5wZE,17,45,43,A baby panda bear is crawling.,ysTmUTQ5wZE_17_45,1
10610,BtQEY2SL4g4,11,16,186,"A man using a pole nudges a cat off a tall utility-like  pole, and the cat leaps all the way to the ground and runs off.",BtQEY2SL4g4_11_16,1
10653,yfMTsYcLt10,0,7,28,A boy runs into wall,yfMTsYcLt10_0_7,1
10713,6pcqRuFEMLs,46,52,48,A boy climbs an obstacle course.,6pcqRuFEMLs_46_52,1
10777,cs33MNhpRNw,16,21,41,A flight attendant shuts a door.,cs33MNhpRNw_16_21,1
10839,uqVCk2oDpSE,194,200,70,A man slicing a bun in half with a knife appears to cut himself.,uqVCk2oDpSE_194_200,1
10900,rwHT2SuNOi8,195,201,3057,A chef lays bacon on a baking tray.,rwHT2SuNOi8_195_201,1
10960,q3I3R_gqy8M,73,79,117,A crying man is talking to a woman lying in a bed and resting his forehead against hers.,q3I3R_gqy8M_73_79,1
11019,6sKdTbRkahM,6,12,64,A man cuts the top and bottom off a pineapple.,6sKdTbRkahM_6_12,1
11062,ifS2nXfCyYo,4,34,36,hamster eating cheese,ifS2nXfCyYo_4_34,1
11195,HPFLN5azwtA,56,63,21,A badger digs a hole.,HPFLN5azwtA_56_63,1
11256,YXixZrSxefk,6,15,44,A man is demonstrating peeling a potato.,YXixZrSxefk_6_15,1
11316,73vUksucPz8,12,20,35,A girl is playing a violin.,73vUksucPz8_12_20,1
11385,CBD9h0jUq3w,1,7,22,A man playing soccer on the beach,CBD9h0jUq3w_1_7,1
11518,_6OTzzK7t9Y,158,170,28,A man is playing the piano.,_6OTzzK7t9Y_158_170,1
11594,Je3V7U5Ctj4,582,587,45,Someone is sprinkling cheese on a flour tortilla.,Je3V7U5Ctj4_582_587,1
11649,CHVhwcOg6y8,1,12,1296,Justin Bieber playing X-Box with a friend.,CHVhwcOg6y8_1_12,1
11716,J4otiwOjQy8,98,112,94,A man is cutting up a tubular looking white vegetable with a purple rind.,J4otiwOjQy8_98_112,1
11891,EdrZtaBUXIo,25,29,70,Smoke is coming out of a jack-o-lantern.,EdrZtaBUXIo_25_29,1
11940,5XxshEdcfAM,85,100,32,A man is dancing.,5XxshEdcfAM_85_100,1
12004,ACOmKiJDkA4,161,170,92,Someone is inserting a yellowish-brown substance into a rice ball.,ACOmKiJDkA4_161_170,1
12058,RSx5G0_xH48,12,17,30,A dog barks at the screen.,RSx5G0_xH48_12_17,1
12122,AEKPjVHSVZc,0,12,83,People in dragon costumes are dancing in the street.,AEKPjVHSVZc_0_12,1
12174,00jrXRMlZOY,0,10,19,A frog is being stroked.,00jrXRMlZOY_0_10,1
12232,0hyZ__3YhZc,485,490,60,Someone is stirring chili in a kettle.,0hyZ__3YhZc_485_490,1
12276,zpgW7m7_LZw,2,15,19,A little boy is playing golf.,zpgW7m7_LZw_2_15,1
12392,ghynaoVNwZc,1,20,79,A car does some stunt driving.,ghynaoVNwZc_1_20,1
12463,1rECrfrdNTo,200,207,21,A woman add some egg yolk to some stir fry.,1rECrfrdNTo_200_207,1
12517,8PQiaurIiDM,94,99,69,"A man cuts throw a rope, suspended from the ceiling, with a sword.",8PQiaurIiDM_94_99,1
12559,4s_0-zIWEog,1,15,77,"A boy eating cereal, while talking to a girl.",4s_0-zIWEog_1_15,1
12608,dJEoDaA6VXc,1,19,138,"A man rides a horse through cones,while shooting.",dJEoDaA6VXc_1_19,1
12664,ZxqkAGNyo8A,12,22,18,a baby playing with a toy piano,ZxqkAGNyo8A_12_22,1
12730,idXJu0BQRvo,2,6,82,A boy is sliding around a water slide.,idXJu0BQRvo_2_6,1
12800,crfrKqFp0Zg,15,25,51,A man is playing a flute.,crfrKqFp0Zg_15_25,1
12854,Pr5LQq42l4M,12,17,200,A man with a wig jumps across a building.,Pr5LQq42l4M_12_17,1
12929,wNv74rvkAw8,30,40,69,Five kittens in a row and then in a circle are eating off of plates.,wNv74rvkAw8_30_40,1
12967,c75SIlAjfjg,6,14,38,Several children practice their routine onstage.,c75SIlAjfjg_6_14,1
13038,_SNE2MYAotU,41,49,66,Someone is petting some kind of animal.,_SNE2MYAotU_41_49,1
13098,jjl2ZMdFCsw,130,142,97,A man is twirling a sword as he turns and moves.,jjl2ZMdFCsw_130_142,1
13151,HqbVbPvlDoM,0,11,52,A woman and dog are walking together.,HqbVbPvlDoM_0_11,1
13212,q8t7iSGAKik,11,31,71,A man is maneuvering a soccer ball with his feet.,q8t7iSGAKik_11_31,1
13252,4QdX5Q3qQsQ,6,14,93,A man lays his hand near his lip and appears to be thinking.,4QdX5Q3qQsQ_6_14,1
13306,R3a9r8qFlhQ,0,12,89,A chef is preparing a snake for dinning.,R3a9r8qFlhQ_0_12,1
13369,SzEbtbNSg04,111,117,80,Someone removes the glass lid from a pot of boiling water and puts uncooked spaghetti into the pot.,SzEbtbNSg04_111_117,1
13476,MJoxGpEswOI,9,16,39,a basketball player making a shoot while lying on the ground,MJoxGpEswOI_9_16,1
13550,ngHDYzhDBk4,5,14,98,Five teenage girls look over their shoulders then turn back and toss pom poms into the air.,ngHDYzhDBk4_5_14,1
13663,KPPCwmU5OHQ,480,486,95,Someone is stirring a kettle of soup with metal tongs.,KPPCwmU5OHQ_480_486,1
13781,V--abChiVVc,30,40,75,An assemble of men dancing.,V--abChiVVc_30_40,1
13840,nBJV56WUDng,38,47,25,a man pealing a banana,nBJV56WUDng_38_47,1
13914,77iDIp40m9E,3,9,27,A puppy kicks dirt on it's mother.,77iDIp40m9E_3_9,1
13981,qhknaG9ifbs,122,127,155,A man breaks a block of ice by swinging a long handled metal tool at it.,qhknaG9ifbs_122_127,1
14029,hNECyt6Bo0A,5,10,44,A class doing a walking exercise.,hNECyt6Bo0A_5_10,1
14154,sWqi41wyXcQ,68,79,68,A body builder is doing exercises.,sWqi41wyXcQ_68_79,1
14220,_QJbjKkfdcs,52,57,52,A man is playing a violin and then a woman starts to sing.,_QJbjKkfdcs_52_57,1
14281,iCiGjZEV7VI,65,75,70,A woman is applying brown makeup to her eyebrows with a brush.,iCiGjZEV7VI_65_75,1
14330,ywHBKayhyvQ,19,28,21,a boy walking over a bridge,ywHBKayhyvQ_19_28,1
14407,0NPtAv3_uVI,46,54,82,"A woman, wearing a life jacket, is skiing on a lake.",0NPtAv3_uVI_46_54,1
14450,UnWgz-mVMXU,2,6,31,A kid sliding down a poll,UnWgz-mVMXU_2_6,1
14518,ZsrPKtx0qyg,7,15,27,A puppy wagging his tail on the steps.,ZsrPKtx0qyg_7_15,1
14580,X7sQq-Iu1gQ,12,22,82,"A man, with his eyes closed, is singing into a microphone.",X7sQq-Iu1gQ_12_22,1
14647,HJHPB_Y8GZE,22,28,66,A dog is running and barking at his image in a walled mirror.,HJHPB_Y8GZE_22_28,1
14750,MJNStEgDKXU,3,10,31,The dog sat down and barked a welcome.,MJNStEgDKXU_3_10,1
14820,4ge5_V-xhP0,138,142,53,A man gets grape juice out of the fridge.,4ge5_V-xhP0_138_142,1
14891,L9wD3kw-8FE,65,73,40,A man chopping a tree with a big knive,L9wD3kw-8FE_65_73,1
14957,X_NLV2KCnIE,60,70,38,A man shooting a car.,X_NLV2KCnIE_60_70,1
15024,o2X6UCaNqKA,27,36,90,A man wearing a headset is running towards targets and shooting at them with a rifle.,o2X6UCaNqKA_27_36,1
15124,qeKX-N1nKiM,106,115,127,A woman pours water and flour into a metal bowl and stirs with chopsticks.,qeKX-N1nKiM_106_115,1
15227,zMg9dChF97A,12,38,37,A potato is being cut on a cutting board.,zMg9dChF97A_12_38,1
15298,_yUiusXxfWI,150,165,48,Jute wine is being cooked in a wok.,_yUiusXxfWI_150_165,1
15363,FH8vgAp4VDU,10,14,593,A man is getting down a staircase.,FH8vgAp4VDU_10_14,1
15441,53dc4z7HLyg,25,29,148,"A dolphin is lying on top of a girl on a dock and moving, while someone else is doing something with it's mouth.",53dc4z7HLyg_25_29,1
15567,XtQdAPV2UZs,4,11,79,A man picks up the front of a blue convertible.,XtQdAPV2UZs_4_11,1
15610,J7zb8YXrmIA,93,99,78,A guy rides the bike across the street,J7zb8YXrmIA_93_99,1
15682,C_1cnNdMwxY,0,8,92,"A man is playing with a puppy on the floor, spinning the puppy around in circles and rubbing it's belly.",C_1cnNdMwxY_0_8,1
15738,kWLNZzuo3do,31,37,114,A woman unwraps some foodstuff on a piece of wood.,kWLNZzuo3do_31_37,1
15785,WrsS6X-FB-I,30,47,311,A person is slicing bread with a bread knife.,WrsS6X-FB-I_30_47,1
15865,VfqlfprZsaQ,75,85,78,Three women in harem costumes are dancing in front of an audience.,VfqlfprZsaQ_75_85,1
15910,2G9fkvBzzQE,10,20,107,A woman is holding a microphone and a bird is talking into it while three contestants laugh.,2G9fkvBzzQE_10_20,1
15966,-7KMZQEsJW4,205,208,34,A man demonstrating how to clean a flower.,-7KMZQEsJW4_205_208,1
16024,4lXdVS697DQ,10,25,42,Two men sail on a boat.,4lXdVS697DQ_10_25,1
16095,7uOiiA4Kxbo,23,35,117,"A man, toting a white dog on his back, is riding down a street on his bicycle..",7uOiiA4Kxbo_23_35,1
16147,GcfWD62sbcs,13,33,122,"An animal, with his head caught in a tubular box, is frantically running around and jumping on hedges.",GcfWD62sbcs_13_33,1
16190,XdB0pVjFYoU,1,8,80,Someone is holding a small monkey.,XdB0pVjFYoU_1_8,1
16236,QOmrchUPnBs,10,20,61,A man is playing a large flute-like instrument.,QOmrchUPnBs_10_20,1
16302,edqyq4Q-7uU,103,109,20,The man danced on the stage.,edqyq4Q-7uU_103_109,1
16422,BnJUWwSx1kE,11,22,52,A wombat is walking about.,BnJUWwSx1kE_11_22,1
16496,nd0ToNwccl4,12,17,51,A football player is talking to a coach.,nd0ToNwccl4_12_17,1
16565,ggic669elLM,200,215,396,A man and his skeleton puppet perform on stage.,ggic669elLM_200_215,1
16612,JXSkYkiKO0I,42,46,70,A man does push-ups.,JXSkYkiKO0I_42_46,1
16738,ao-9B8IV9_E,175,187,51,A dog walks over a kid who is inside his house.,ao-9B8IV9_E_175_187,1
16850,fX5G_JwPlLo,640,660,29,A man is slicing the tape on a box to open it.,fX5G_JwPlLo_640_660,1
16917,cFzSEIGrEfA,0,24,163,A man is removing a skin of a fish with a knife.,cFzSEIGrEfA_0_24,1
16993,Ayh26v6Nies,17,22,51,Two puppies are playing with a piece of paper.,Ayh26v6Nies_17_22,1
17062,Y4BeJ-64294,20,30,51,A man shoots at a barrel.,Y4BeJ-64294_20_30,1
17130,Qtu-PXuvCx4,12,17,32,A baby eats a chocolate bunny.,Qtu-PXuvCx4_12_17,1
17181,-DKuLXYoY3g,14,20,55,A boy is playing,-DKuLXYoY3g_14_20,1
17236,_0nX-El-ySo,83,93,69,A man is cutting a piece of paper in half lengthwise using scissors.,_0nX-El-ySo_83_93,1
17328,D2FbgK_kkE8,121,151,16,a lady cutting a pineapple,D2FbgK_kkE8_121_151,1
17411,BIqVvRh_cEY,143,149,59,A young boy is running.,BIqVvRh_cEY_143_149,1
17467,GWQTAe64m-0,91,94,67,A man is taking pictures with a camera of a woman modeling.,GWQTAe64m-0_91_94,1
17508,TwQzFqBqgeA,0,10,33,A man is relaxing on the beach.,TwQzFqBqgeA_0_10,1
17585,qPXynwa_2iM,15,25,58,A dog runs across water in slow motion.,qPXynwa_2iM_15_25,1
17717,d_BWuttLRFM,42,52,38,A boy plays a flute.,d_BWuttLRFM_42_52,1
17777,Lw0eGsYxElA,11,14,60,A man in a suit snaps a stick in half.,Lw0eGsYxElA_11_14,1
17937,HZqscSWtHmo,24,34,28,A man sings into a microphone.,HZqscSWtHmo_24_34,1
17992,98shpdib9sg,55,62,21,A boy is moving his shoulders from side to side.,98shpdib9sg_55_62,1
18076,iuqVpMdb1NM,35,43,76,Someone folds a piece of paper in half with the yellow side out.,iuqVpMdb1NM_35_43,1
18121,F44bLc6t7-I,1,8,44,A chef is serving food and speaking.,F44bLc6t7-I_1_8,1
18161,QGgJlHi3tjw,1,15,62,A motivational speaker does a speech.,QGgJlHi3tjw_1_15,1
18243,e-j59PqJjSM,264,277,78,Someone quarters a tomato using a cleaver.,e-j59PqJjSM_264_277,1
18288,W8l_ezoU8Lc,55,70,354,A man is playing a guitar.,W8l_ezoU8Lc_55_70,1
18357,2YhDTpzxd3c,149,154,15,A woman feeds a man food.,2YhDTpzxd3c_149_154,1
18415,uH8ObB_dyOk,159,166,103,"Two women are shopping in a store, and one woman points to something and the other woman pushes a cart in that direction.",uH8ObB_dyOk_159_166,1
18450,qNjeEx92rTA,281,299,562,A man mixing chocolate in a bowl.,qNjeEx92rTA_281_299,1
